NAME,TYPE,RELIGIOUS,FREEDOM FROM TRANS IDEOLOGY,STATE,NOTES,WEBSITE
Auburn University,Private,No,Poor,ALABAMA,"Honors TDOR; offers counseling for gender ID; some academic depts have dedicated ""LGBTQ+"" pages; converted all single-occupancy bathrooms to be ""gender-neutral""",auburn.edu
The University of Alabama,Public,No,Poor,ALABAMA,"Offers Lavender graduation; hosts LGBTQIA+ dance; observes TDOR; student health insurance covers HRT; allows gender self-ID on university documents, has SafeZone training.",ua.edu
University of Alabama at Birmingham,Public,No,Poor,ALABAMA,"Runs an ""LGBTQ+"" mental health and wellness clinic; which offers letters of referral for hormones; UHS provides transgender services; incl. counseling; honors TDOR; named AL's best uni for LGBT students in 2019.",uab.edu
University of Alabama in Huntsville,Public,No,Poor,ALABAMA,"Counseling center committed to diversity; incl. gender ID; hosts ""Breaking the Binary"" workshop; Women's; Gender; and Sexuality dept. ""promotes the social awareness of. . . gender/sexual minorities. """,uah.edu
University of Alaska Fairbanks,Public,No,Poor,ALASKA,"Has an Information on LGBTQ2IA+ Students page which provides guidance on how to update name, pronouns, and gender markers.",uaf.edu
University of Alaska Anchorage,Public,No,Poor,ALASKA,"Offers an ""LGBTQ+ Support"" page that lists ""all-gender"" bathrooms, SafeZone trainings, and means for students to self-report name, pronoun, and gender identity preferences on academic and medical records.",https://www.uaa.alaska.edu/
Arizona State University,Public,No,Poor,ARIZONA,Provides transgender healthcare; group counseling; and referrals for gender-affirming services; offers Safe Zone training and gender-inclusive housing; supports student organizations like Out @ ASU; allows preferred name and gender marker changes; with gender-neutral bathrooms available campus-wide.,asu.edu
Northern Arizona University,Public,No,Poor,ARIZONA,Provides transgender healthcare including hormone therapy and surgery coverage; offers Safe Zone training and gender-inclusive housing with priority for transgender students; supports LGBTQIA student organizations; and allows preferred name changes and access to gender-neutral bathrooms.,nau.edu
University of Arizona,Public,No,Poor,ARIZONA,Offers transgender healthcare through student insurance; provides gender-affirming treatment via a multidisciplinary Trans Treatment Team; supports voice training; offers Safe Zone training; provides gender-inclusive housing through Marsha's Place and other living communities; supports LGBTQ+ student organizations and daily events; allows preferred name and pronoun changes; as well as access to gender-neutral bathrooms.,arizona.edu
Arkansas State University,Public,No,Poor,ARKANSAS,"""Gender Affirmation and Inclusion"" initative; Safe Zone trainings.",astate.edu
University of Arkansas,Public,No,Poor,ARKANSAS,Tons of LGBTQ resources; incl. resources on gender ID and pronouns; Safe Zone program.,uark.edu
California Institute of Technology,Private,No,Poor,CALIFORNIA,"Has a page dedicated to ""Gender Affirming Care"" with everything from counseling to goal planning to self- injection guidance to continuing care.",caltech.edu
"California State University, Fresno",Public,No,Poor,CALIFORNIA,"Has a ""LGBTQ+ and Gender Affirming Care"" page through its counseling center incl. provision of hormone therapy w/ no requirement that students be in or have had therapy related to gender ID.",fresnostate.edu
"California State University, Los Angeles",Public,No,Poor,CALIFORNIA,"Offers a fellowship in ""Transgender Studies""; has a Women's; Gender; & Sexuality Studies program; runs a Gender & Sexuality Resource Center; which appears to have a defunct site.",calstatela.edu
Chapman University,Private,No,Poor,CALIFORNIA,"Has a ""Gender-Inclusive Policies"" page with resources on ""gender- diverse"" housing; pronoun usage; participation in sports study abroad accommodations and more.",chapman.edu
Claremont McKenna College,Private,No,Poor,CALIFORNIA,"Has a ""Queer Resource Center; "" which aims to ""promote empowerment and social justice"" through provision of various gender-related resources.",cmc.edu
Harvey Mudd College,Private,No,Poor,CALIFORNIA,"Has a ""Resources for Transgender Students"" page that is represented as a ""guide to transitioning at Harvey Mudd College"" with various on- and off-campus resources.",hmc.edu
Occidental College,Private,No,Poor,CALIFORNIA,"Has an ""LGBTQIA+ Support"" page with various resources such as a dedicated ""Queer & Trans Guide; "" ""Lived Name & Pronoun Policy; "" and ""Trans+ Health Guide. """,oxy.edu
Pitzer College,Private,No,Moderate,CALIFORNIA,"Has a ""Resources for LGBTQIA+ Students"" page that refers students to numerous off-campus resources; nothing specific to the school itself.",pitzer.edu
Pomona College,Private,No,Moderate,CALIFORNIA,"Offers comprehensive page on ""Diversity Resources for Students"" but nothing specific to gender ID.",pomona.edu
San Diego State University,Public,No,Poor,CALIFORNIA,"Uses the acronym ""2SLGBTQIA+"" in collaboration between the Pride and Native Resource centers; has comprehensive other resources incl. Safe Zone training and a glossary.",sdsu.edu
San Jose State University,Public,No,Poor,CALIFORNIA,As of Nov. 2024; suspended its assistant volleyball coach for filing a Title IX report against a trans athlete on her team; provides comprehensive gender-related resources incl. a guide on name changes & using pronouns.,sjsu.edu
Santa Clara University,Private,No,Poor,CALIFORNIA,"Offers Safe Zone training; has a dedicated ""Trans* Resources"" page that states its ""trans* community"" is very small; uses ""trans*"" to include not only individuals who ID as trans but also anyone who ""transgresses social norms in a variety of ways. """,scu.edu
Scripps College,Private,No,Moderate,CALIFORNIA,"Published a blog post by Student Life called ""Reviving a space or Queer Students""; has a ""Queer Resource Center"" but no site for it.",scrippscollege.edu
Stanford University,Private,No,Poor,CALIFORNIA,"Has a ""Stanford Pride"" page that states a membership of over 4000; the overarching ""Queer Student Resources (QSR)"" page has its own website and various resource lists.",stanford.edu
"University of California, Berkeley",Public,No,Poor,CALIFORNIA,Provides plentiful resources specific to transgender identity; incl. carefully outlined inclusion policies for gender- related name and pronoun changes; healthcare; housing; sports; & more.,berkeley.edu
"University of California, Davis",Public,No,Poor,CALIFORNIA,"Provides plentiful resources specific to transgender identity and states its commitment to ""an ongoing process of ensuring that trans and nonbinary students are treated with dignity and respect. . . supported by policies at the campus; state; and federal levels. """,ucdavis.edu
"University of California, Irvine",Public,No,Poor,CALIFORNIA,"Has integrated LGBT Resource Center with dedicated ""Transgender Care Specialist"" and plentiful other resources focused on trans ID.",uci.edu
"University of California, Los Angeles",Public,No,Poor,CALIFORNIA,"Boasts its status as a ""Top 10 Trans- Friendly Campus"" per the Campus Pride Index; provides gender-related medical interventions under student health insurance; offers plentiful on- and off-campus resources; among other things. ",ucla.edu
"University of California, Merced",Public,No,Poor,CALIFORNIA,"Provides plentiful resources specific to transgender identity and gives in- depth descriptions of its gender- related medical; housing; and ""identity marker"" policies.",ucmerced.edu
"University of California, Riverside",Public,No,Poor,CALIFORNIA,"Provides plentiful resources specific to transgender identity and gives in- depth descriptions of its gender- related policies; including its ""UCR Trans Group & T-Camp Retreat. """,ucr.edu
"University of California, San Diego",Public,No,Poor,CALIFORNIA,"Offers a comprehensive Q&A specific to transgender identity, which states a broad commitment to transgender integration, including access to gender-related hormones and surgeries under university health plans.",ucsd.edu
"University of California, Santa Barbara",Public,No,Poor,CALIFORNIA,"Has dedicated ""Trans@UCSB"" page with information on social transition; medical transition; and various trans definitions; university healthcare policies cover hormones; surgery; and various other non-surgical procedures incl. hair removal.",ucsb.edu
"University of California, Santa Cruz",Public,No,Poor,CALIFORNIA,"Has dedicated ""Trans and Nonbinary Care"" page through the Student Health Center; university healthcare policies cover hormones; surgery; and various other non-surgical procedures incl. hair removal and gender-related voice training.",ucsc.edu
University of San Francisco,Private,No,Poor,CALIFORNIA,"Has a ""LGBTQ+"" resources page w/ comprehensive resources incl. the Human Rights Campaign and various other affirmation-only groups.",usfca.edu
University of Southern California,Private,No,Poor,CALIFORNIA,"Has a ""Trans@USC"" page that alerts students to various policies and resources such as name and gender change processes; ""all-gender"" baths; ""gender-affirming"" healthcare; ""gender inclusive"" housing; trans athletic inclusion; and gender-related student organizations.",usc.edu
Colorado College,Prviate,No,Poor,COLORADO,"Supports self-ID; has a ""queer & trans collective""; provides many LGBT and gender-related resources; incl. for youth; offers gender-neutral housing.",coloradocollege.edu
Colorado School of Mines,Public,No,Poor,COLORADO,"""Gender-inclusive"" housing; working toward ""more inclusive"" data collection; provides uni-endorsed trans resources.",mines.edu
Colorado State University,Public,No,Poor,COLORADO,"Released a ""trans-affirming statement""; lots of resources on pronouns and gender ID; ""gender-inclusive"" housing.",colostate.edu
University of Colorado - Boulder,Public,No,Poor,COLORADO,"Provides affirming medical care to students, recommends this as a resource for educators to give to questioning students; open name change process, provides transition FAQ for faculty.",colorado.edu
University of Colorado - Denver,Public,No,Poor,COLORADO,Open name change & pronoun policy; collects data on sexual orientations of students: plentiful LGBT resources including transition guides.,ucdenver.edu
University of Denver,Prviate,Formerly,Poor,COLORADO,"Open name change & pronoun policy; provides ""pride closet""; plentiful LGBT resources and orgs; encourages self-ID for bathrooms and locker rooms.",du.edu
Connecticut College,Private,No,Poor,CONNECTICUT,"Offers comprehensive trans health care; provide Safe Zone training; facilitates gender-inclusive housing through the housing application; supports ""LGBTQIA"" students with four different student clubs and events; including Coming Out Day; Trans Day of Remembrance; Pride Rally; and Lavender Graduation; maintains nearly all bathrooms on campus as gender-inclusive; and implements a Preferred Name Option.",conncoll.edu
Trinity College,Private,No,Poor,CONNECTICUT,Covers healthcare related to gender identity through Trinity's student insurance plan; including hormone replacement therapy; select gender-affirming procedures; and trans-inclusive counseling services; offers HRT and surgical support letters; assist with HRT injections; provides Safe Zone training; and accommodates gender-inclusive housing requests for freshmen; while allowing all other students to choose roommates regardless of sex; supports LGBTQ+ students through the Queer Resource Center and EROS club with regular meetings and events; maintains all-gender bathrooms throughout campus; adheres to NESCAC policy for sports; implements a chosen name option via a self-service portal; encouraging the entry of pronouns; and lists resources for trans healthcare on the Queer Center page.,trincoll.edu
University of Connecticut,Public,No,Poor,CONNECTICUT,Includes hormone replacement therapy and gender-affirming surgeries in the UConn Student Health Insurance Plan (SHIP); along with access to a transgender voice clinic at the speech and hearing clinic; offers specialized LGBTQIA health services through the Gender Care Team; including hormone therapy; letters of support; counseling; and a Gender Affirming Closet; all staff in the Rainbow Center use they/them/theirs pronouns; provides gender-inclusive housing by application; primarily located on the 5th and 6th floors of Brock Hall; maintains bathrooms by identity; along with neutral bathrooms throughout campus; implements a chosen name option via a self-service portal while emphasizing the importance of using correct names and pronouns; and lists resources for trans healthcare on the Rainbow Center page.,uconn.edu
Wesleyan University,Private,No,Poor,CONNECTICUT,CIGNA insurance appears to cover transgender healthcare; and the health center offers financial support; resources; and group therapy; provide referrals and additional resources; requires Title IX training for employees; offers an open house for underclassmen; accommodates gender-neutral housing requests for first-year students; with options to live with any roommate regardless of sex after the first year; supports LGBTQ students through campus organizations like the Campus Resource Center; HOUSE; Spectrum; and Wes Burlesque clubs; which feature drag and burlesque events; maintains all-gender bathrooms across campus and adhere to NCAA sports policies; and allows preferred names to be updated via a self-service portal.,wesleyan.edu
Yale University,Private,No,Poor,CONNECTICUT,"Provides comprehensive transgender healthcare covered by student insurance; including the Exploring Gender group therapy and a Gender Affirming Closet; offers gender-inclusive housing in Yale College with shared mixed-gender bathrooms in most areas; while requests for single-gender bathrooms can be made during the Intent phase of Room Draw; supports LGBTQ students through the LGBTQ Center and the Trans@Yale club; which features an extensive online ""survival guide; "" hosts weekly meetings; and organizes monthly lunches and events; maintains all-gender bathrooms across campus in compliance with NCAA sports policies; and allows preferred names to be updated via a self-service portal.",yale.edu
Deleware State University,Public,No,Excellent,DELAWARE,No prominent search results related to gender identity.,https://www.desu.edu/
University of Delaware,Public,None,Poor,DELAWARE,"Provides a variety of trans-related services and alerts students to these services via a ""LGBTQ+ Health"" page; allows students to designate preferred name; pronouns; and gender identity.",udel.edu
Florida International University,Public,No,Poor,FLORIDA,"""Gender-inclusive"" housing; easy process for changing name and gender ID on documents; provides ""LGBTQ"" course offerings; counsiling/support groups; health insurance covers hormones.",fiu.edu
Florida State University,Public,No,Poor,FLORIDA,"Offers ""LGBTQ+"" housing option; UHS provides medical support for ""gender transitioning patients""; faculty research issues of gender ID; the Women's Studies program includes classes on gender and sexuality.",fsu.edu
University of Central Florida,Public,No,Poor,FLORIDA,"Offers Safe Zone training; offers ""LGBTQ+"" Student Support Services; incl. a list of ""gender-neutral"" bathrooms; a dedicated lounge space; and the ""Lavender Council""; was once ranked the ""top college for LGBTQ+ students in Florida; considers trans ID in housing.",ucf.edu
University of Florida,Public,No,Poor,FLORIDA,"Offers a ""Lavender"" living and learning community; university records can list preferred gender / name except where legally required; UHS provides ""gender-affirming"" care.",ufl.edu
University of Miami,Private,No,Poor,FLORIDA,"""Gender-inclusive"" housing; offers Safe Zone training; gender-related courses; student health insurance policy is ""trans-inclusive""; allows gender self-ID on university documents.",miami.edu
University of South Florida,Public,No,Poor,FLORIDA,"Offers Safe Zone training; ""LGBTQ+"" living and learning community; UHS provides hormones to trans students and will refer for surgery if desired; students protested Gov. De Santis's request that universities submit spending on GAC.",usf.edu
Emory University,Private,No,Poor,GEORGIA,Offers comprehensive coverage for transgender care through its Student Health Insurance Plan; provides an information guide for navigating transgender resources via the LGBT Center; and runs the Gender Affirming Items Initiative to supply essential gender-affirming clothing at no cost; hosts Safe Space Ally training; offers gender-inclusive housing; has an Office of LGBT Life with a trans resources page; and supports nine student clubs while allowing individuals to use bathrooms that align with their gender identity; maintaining gender-neutral bathrooms across campus. Designated names and pronouns can be managed through a self-service portal.,emory.edu
Georgia Institute of Technology,Public,No,Poor,GEORGIA,Provides access to student health insurance details; indicating that hormones are covered as noted on the Pride Alliance website and Trans Resources; offers individual and group counseling for LGBTQIA students through the LGBTQIA Center; although specific information is not found on the Counseling Center's page; commits to inclusive care for transgender and gender-diverse individuals at Stamps Health Services; assisting with hormone therapy; lab testing; and prescription refills; employs 5 out of 8 LGBTQIA staff who are trans/non-binary; including the Director; offers gender-inclusive housing through the housing app; hosts the LGBTQIA Resource Center; which includes Pride Alliance and Grad Pride clubs; and organizes weekly meet-ups and events like Queer Prom; TDOR; and Lavender Grad; along with programs for health and well-being; maintain all-gender bathrooms across campus; allow chosen name changes via a Name Change Form; with guidance resources provided by Pride Alliance.,gatech.edu
Georgia State University,Public,No,Moderate,GEORGIA,Lacks coverage for transgender-specific healthcare in student health insurance; indicates the Counseling Center runs a Transgender Support Group; finds gender-inclusive housing available through the housing application; offers resources through the Cultures; Community & Inclusion office; which includes the Alliance; Black OUT; and o STEM clubs; the Gender and Sexuality Resource Room provides services like programming; workshops; organizational support; and mentoring for students identifying as or connecting to LGBTQ+ and varying gender identities; with events such as Lavender Grad and a Drag Show hosted by the Alliance club; and courses on LGBTQ+ topics offered by the Women; Gender & Sexuality Studies department; allows preferred name changes via a self-service portal; and hosts a Planned Parenthood club on campus.,gsu.edu
University of Georgia,Public,No,Poor,GEORGIA,Offers hormone therapy through the Health Center and LGBTQIA resources via the Pride Center while lacking coverage for transgender-specific healthcare in student insurance; gender specialists; and gender-inclusive housing; provides Dawg Ally training; hosts five student clubs and three support groups (including one for trans students); maintains all-gender bathrooms; and allows chosen name and gender changes through a self-service portal.,uga.edu
"University of Hawaii at Manoa, Honolulu",Public,No,Moderate,HAWAII,"Offers and advertises Safe Zone training, hosts a Rainbow Village Residential Learning Program, maintains an LGBTQ+ Center and Rainbow Ohana honor society with weekly meetings and events like a native Hawaiian drag show, provides gender-neutral bathrooms, and facilitates a process for preferred name changes, although pronoun usage by staff is not compulsory.",manoa.hawaii.edu
Boise State University,Public,No,Poor,IDAHO,"Offers a ""trans-friendly"" resource guide with extensive links to srevices and support provided by the school.",boisestate.edu
University of Idaho,Public,No,Poor,IDAHO,"Has a dedicated ""LGBTQA Office"" that provides a variety of rsources and policies specific to trans identity.",uidaho.edu
DePaul University,Private,Yes,Poor,ILLINOIS,"Offers minor in ""LGBTQ Studies""; has dedicated space for ""LGBTQIA"" resource center; houses gender- related student orgs; discussion groups; etc. ; allows gender self-ID where possible. ",depaul.edu
Illinois Institute of Technology,Private,No,Moderate,ILLINOIS,"Offers ""LGBTQ"" resources; allows students to self-select gender and pronouns in some applications.",iit.edu
Illinois State University,Public,No,Poor,ILLINOIS,"Offers Women's; Gender; & Sexuality program; has dedicated page for LGBTQ students; incl. resources on ""all-gender"" restrooms; pronoun changes; etc. ; offers gender-related scholarships & support funds.",illinoisstate.edu
Knox College,Private,No,Poor,ILLINOIS,"""Gender-inclusive"" housing; has dedicated ""LGBTQ"" resource center; offers ""LGBTQ Studies"" program; has ""trained trans-inclusive counseling staff; provides ""Lavender"" graduation.",knox.edu
Loyola University Chicago,Private,Yes,Poor,ILLINOIS,"Center for Diversity and Inclusion has ""LGBTQIA"" initiatives; offers a course in transgender medicine; which addressed the treatment of minors.",luc.edu
Northeastern Illinois University,Public,No,Moderate,ILLINOIS,"Offers Women's; Gender & Sexuality Studies major; ""LGBTQ Studies"" minor; faculty research on ""transgender intimate partner violence. """,neiu.edu
Northwestern University,Private,No,Poor,ILLINOIS,"Issued ""Statement in Support of Transgender Rights""; UHS provides hormones and referrals to the larger NW medical system for surgery; offers ""all-gender"" housing.",northwestern.edu
Southern Illinois University Carbondale,Public,No,Poor,ILLINOIS,"UHS provides ""gender-affirming"" care; has ""LGBTQ"" Resource Center; offers ""Sexuality Diversity Studies"" minor; shares resources on legal and preferred name change procedure for students who identify as ""LGBTQ. """,siu.edu
Southern Illinois University Edwardsville,Public,No,Poor,ILLINOIS,"Offers Safe Zone training; dedicated page for ""LGBTQIA"" resources; ""LGBTQ"" housing options available.",siue.edu
University of Chicago,Private,No,Poor,ILLINOIS,"""Gender-inclusive"" housing; UHS provides ""gender-affirming"" care; has ""gender-neutral"" restrooms; offers single-occupancy locker rooms.",uchicago.edu
University of Illinois Chicago,Public,No,Poor,ILLINOIS,Observes TDOV; has in-house surgeon states that it abides by NCAA guidelines for trans inclusion in sport.,uic.edu
Wheaton College,Private,Yes,Excellent,ILLINOIS,"Expresses traditional views on gender. States a biblical view of ""gender"" (rather than ""sex"") in its ""Gender Equity Vision Statement""; offers cert. in ""Gender Studies""; provides ""Refuge"" program for those navigating issues w/ sexual orientation or gender ID; claims its ""biblically faithful. "" States a biblical view of ""gender"" (rather than ""sex"") in its ""Gender Equity Vision Statement""; offers cert. in ""Gender Studies""; provides ""Refuge"" program for those navigating issues w/ sexual orientation or gender ID; claims its ""biblically faithful. """,wheaton.edu
DePauw University,Private,Yes,Poor,INDIANA,"Support is offered by ""The Justin and Darrianne Christian Center for Diversity and Inclusion"" and has a dedicated page on transgender student resources including information on restrooms; housing; name/gender marker changes; a link to ""NCAA Inclusion of Transgender Student-Athletes"" and links to ""gender health"" programs; including one that is open to minors. ",https://www.depauw.edu/
Indiana University Bloomington,Public,No,Poor,INDIANA,"The school's LGBTQ+ Culture Center offers a dedicated page on Transitioning at IU which provides an extremely extensive guide on how to access various services and policies related to gender identity. The center also offers a gender affirming closet, numerous scholarships, and a TrUSt (Transgender Union for Students)",https://www.indiana.edu/
Purdue University,Public,No,Poor,INDIANA,"Offers a dedicated page for 'Trans Students; Staff and Faculty"" which includes information on ""medical transition""; restrooms; housing; gender marker change; vocal therapy; and off campus resources include contact info for affirming doctors and ""trans affirming beauty services"". Purdue health insurance plans for staff; faculty and students provide coverage for hormone replacement therapy and gender-affirming surgeries.",https://www.purdue.edu/
University of Notre Dame,Private,Yes,Moderate,INDIANA,"Could be low: In 2024 they released ""Beloved Friends and Allies"" pastoral plan in a press release which seeks to support LGBTQ students; promoting a welcoming campus for LGBTQ students through initiatives such as the ""Gender Relations Center""; Campus Ministry; and the Counseling Center; offering support; education; plan includes training for campus leaders and the establishment of a peer support organization; all while being informed by their Catholic identity. ",https://www.nd.edu/
Grinnell College,Private,No,Poor,IOWA,"""Gender-inclusive"" housing; Pres. issued ""letter of support"" for the trans community; allows self-ID in sex- seggregated spaces.",https://www.grinnell.edu/
Iowa State University,Public,No,Poor,IOWA,"""Gender-inclusive"" housing; provides letters to facilitate medical transiton; has Center for ""LGBTQIA+ Student Success""; lists ""all-gender"" bathrooms.",https://www.iastate.edu/
University of Iowa,Public,No,Poor,IOWA,"UHS provides ""gender-affirming care"" to students.",https://uiowa.edu/
