Marquette University,Private,Yes,Poor,WISCONSIN,"Has dedicated ""LGBTQ+ Resource Center""; offers Gender & Sexuality Studies program.",marquette.edu
University of Wisconsin Eau Clair,Public,No,Poor,WISCONSIN,Gender-inclusive housing; offers Rainbow Floor in regular dorms; offers comprehensive Trans at UWEC resource list.,uwec.edu
University of Wisconsin Madison,Public,No,Poor,WISCONSIN,Has inclusive facilities policy; offers courses related to gender and gender identity; UHS has dedicated page for Trans and Gender Diverse Health.,wisc.edu
University of Wisconsin Milwaukee,Public,No,Poor,WISCONSIN,Provides gender-affirming counseling and hormone therapy; LGBTQ+ Resource Center has dedicated transgender page.,uwm.edu
University of Wyoming,Public,No,Moderate,WYOMING,"Offers ""The Gender Unicorn"" as a valid resource; has ""School of Culture; Gender & Social Justice"" incl. a minor in ""Queer Studies""; appears somewhat siloed.",uwyo.edu
Wyoming Catholic College,Private,Yes,Excellent,WYOMING,"No prominent search results related to gender; one podcast on ""transgenderism... as man's gnostic temptation to break limits meets today's digital technology.""",https://wyomingcatholic.edu/